<?xml version="1.0" encoding="UTF-8"?>
<!DOCTYPE mapper PUBLIC "-//freesql.org//DTD Mapper 3.0//EN"  "http://freesql.org/dtd/freesql-3-mapper.dtd">
<mapper namespace="jc">
	<!--监察任务上报 ${sqlDutyUntils}   -->
	<select id="findSbTaskReport" parameterType="java.util.HashMap"  resultType="com.zg.jc.beans.TaskReportBeans">
		select  
		  task.id,
		  task.year,
		  projectType.typeOne ,
		  projectType.typeTwo ,
		  task.seq,
		  task.content,
		  task.finishDateLimit,
		
		   ( select isnull(max(proceePercent),0) 
		   		from jc_taskReport 
		   		where 
		   	  		reportDate= ( select max(reportDate) reportDate from jc_taskReport jc where jc.taskId=task.id <if test="dutyUntil != null and dutyUntil!='' "> and jc.dutyUntil = '${dutyUntil}'</if> ) 
		   	  		and taskId=task.id  
		   	  		<if test="dutyUntil != null and dutyUntil!='' "> and dutyUntil = '${dutyUntil}'</if>
		   ) as proceePercent,
		  task.state,
		(
		select isnull(count(tr.id),0)  from jc_taskReport as tr 
		where 
		  tr.nearReportDate &lt;= #{sysDate} and tr.planReportDate &gt;= #{sysDate} and 
		  tr.state=0 and tr.taskId=task.id
		  <if test="dutyUntil != null and dutyUntil!='' ">
				and tr.dutyUntil = '${dutyUntil}'
		  </if>
		) as yellowColor,
		
		(
		select isnull(count(tr.id),0)  from jc_taskReport as tr 
		where 
		 tr.planReportDate &lt;= #{sysDate} and 
		  tr.state=0 and 
		  tr.taskId=task.id
		  <if test="dutyUntil != null and dutyUntil!='' ">
				and tr.dutyUntil = '${dutyUntil}'
		  </if>
		) as redColor
		
		from 
		   jc_task as task,
    	   jc_projectType as projectType 
		
		<where>
		 	task.projectTypeId=projectType.id 
		 	
			 and   charindex('${dutyUntil}',task.dutyUnits)>0
			
			<if test="year != null">
				and task.year = ${year}
			</if>
			<if test="state != null">
				and task.state = ${state}
			</if>
			<if test="projectTypeId != null and projectTypeId != ''">
				and projectType.id = '${projectTypeId}'
			</if>
			<if test="content != null and content != ''">
				and task.content like '${content}%'
			</if>
		</where> 
		order by task.state, projectType.typeOne,cast(projectType.seq as int),task.seqnumber
	</select>
	
	
	<!--监察任务督查-->
	<select id="findDcTaskReport" parameterType="java.util.HashMap"  resultType="com.zg.jc.beans.TaskReportBeans">
		select  
		  task.id,
		  task.year,
		  projectType.typeOne ,
		  projectType.typeTwo ,
		  task.seq,
		  task.content,
		  task.finishDateLimit,
		
		   (select avg(proceePercent) from 
			(
			  select  
				rt.dutyUntil,
				(select isnull(max(proceePercent),0) from  jc_taskReport where taskId=task.id and  dutyUntil=rt.dutyUntil ) as proceePercent
			from 
			   jc_taskReport as rt 
			where 
			   rt.taskId=task.id 
			group by 
			   dutyUntil
			) as tmpTable) as proceePercent,
		  task.state,
		(
		select isnull(count(tr.id),0)  from jc_taskReport as tr 
		where 
		  tr.nearReportDate &lt;= #{sysDate} and tr.planReportDate &gt;= #{sysDate} and 
		  tr.state=0 and tr.taskId=task.id
		) as yellowColor,
		
		(
		select isnull(count(tr.id),0)  from jc_taskReport as tr 
		where 
		 tr.planReportDate &lt;= #{sysDate} and 
		  tr.state=0 and 
		  tr.taskId=task.id
		) as redColor,
		(
		select count(*) from jc_taskReport as tr 
		 where
		 tr.state=1 and 
		 tr.taskId=task.id and
		 tr.modifyState = 1
		 ) as modifyState
		
		from 
		   jc_task as task,
    	   jc_projectType as projectType 
		<where>
		 	task.projectTypeId=projectType.id 
			<if test="year != null">
				and task.year = ${year}
			</if>
			<if test="state != null">
				and task.state = ${state}
			</if>
			<if test="projectTypeId != null and projectTypeId != ''">
				and projectType.id = '${projectTypeId}'
			</if>
			<if test="content != null and content != ''">
				and task.content like '${content}%'
			</if>
			<if test="dutyUntil != null and dutyUntil!='' ">
				and   charindex('${dutyUntil}',task.dutyUnits)>0 
			 </if>
			 <if test="dutyLeader != null and dutyLeader!='' ">
				and   charindex('${dutyLeader}',task.dutyLeaders)>0 
			 </if>
			 
		</where> 
		order by task.state, projectType.typeOne,cast(projectType.seq as int),task.seqnumber
	</select>
	
</mapper>